Date,Route,Rating,Notes,URL,Pitches,Location,Avg Stars,Your Stars,Style,Lead Style,Route Type,Your Rating,Length,Rating Code
2024-07-25,The Bastille Crack,5.7,To get to outer space ,https://www.mountainproject.com/route/105748490/the-bastille-crack,1,Colorado > Boulder > Eldorado Canyon State Park > The Bastille > The Bastille - N Face,3.5,3,,,Trad,,350.0,1800.0
2024-07-25,Northcutt Start,5.10d,"Took a nice whip on piton. Was cocky after onsighting it. Jugs are not jugs, lol.",https://www.mountainproject.com/route/105748678/northcutt-start,1,Colorado > Boulder > Eldorado Canyon State Park > The Bastille > The Bastille - N Face,3.1,-1,Lead,Fell/Hung,"Trad, TR",,60.0,3500.0
2024-07-25,Outer Space,5.10b/c R,"w Annie. Started on Northcut and whipped at crux. Then cruised outerspace. That last pitch is sustained and HQ route. Annie lead the chimney pitch, it  was a headey lead.",https://www.mountainproject.com/route/105748612/outer-space,2,Colorado > Boulder > Eldorado Canyon State Park > The Bastille > The Bastille - N Face,3.9,-1,Lead,,Trad,,,3100.0
2024-07-09,Trouble And Strife,5.10b/c,"Short lightning bolt crack with finger jam, hand jam, calf jam, and optional fist jam",https://www.mountainproject.com/route/105751249/trouble-and-strife,1,Colorado > Boulder > Eldorado Canyon State Park > Peanuts Walls > Lower Peanuts,2.0,-1,Lead,,"Trad, TR",,,3100.0
2024-07-09,West Crack (aka Star Wars),5.8,"w Annie.
First time to peanuts. Straight forward and forgettable due to the ease. I had the song Mama said by Lukas graham stuck in my head but I couldn’t remember the melody right.",https://www.mountainproject.com/route/105749299/west-crack-aka-star-wars,2,Colorado > Boulder > Eldorado Canyon State Park > Peanuts Walls > Lower Peanuts,3.1,-1,Lead,,Trad,,,2100.0
2024-06-23,Freeway,5.0,"w E 
Last day before stuff gets shipped to new haven",https://www.mountainproject.com/route/105752023/freeway,6,Colorado > Boulder > Flatirons > North > Second Flatiron,3.3,-1,,,Trad,,600.0,1000.0
2024-06-19,Wizard's Path,5.11a,"Thotful and a steady puzzle of looking for holds. Reminded me a lot of the slabs in idaho north of the pickle place.

With E and Ulla",https://www.mountainproject.com/route/106524966/wizards-path,1,Colorado > Estes Park Valley > CO Hwy 7 & Tributaries > The Crags > Lower Great Face > C. Wizard's Gate,3.5,-1,Lead,Onsight,Sport,,90.0,4600.0
2024-06-19,Magic Dagger,5.13a,Crux is fun with juggy sidepulls. First time on it was headey due to very loose-looking blocks and crumby start. But it was actually terrific. I think I’d prolly send with 2more attempts.,https://www.mountainproject.com/route/106827003/magic-dagger,1,Colorado > Estes Park Valley > CO Hwy 7 & Tributaries > The Crags > Lower Great Face > C. Wizard's Gate,3.3,-1,Lead,Fell/Hung,Sport,,90.0,8600.0
2024-06-19,Crystal Staircase,5.9,Difficult to climb quickly as you search for holds ,https://www.mountainproject.com/route/106524927/crystal-staircase,1,Colorado > Estes Park Valley > CO Hwy 7 & Tributaries > The Crags > Lower Great Face > C. Wizard's Gate,2.6,-1,Lead,,Sport,,50.0,2400.0
2024-06-19,Dead End,5.9,"Mediocre warmup.
The arete is like a siren calling you from the safety of the crack.",https://www.mountainproject.com/route/106525326/dead-end,1,Colorado > Estes Park Valley > CO Hwy 7 & Tributaries > The Crags > Lower Great Face > C. Wizard's Gate,2.0,-1,Lead,,Trad,,50.0,2400.0
2024-06-19,G3,5.11a,Hardest part was t he slab right before the roof. The roof was just a big move from jug to jug. Fun tho!,https://www.mountainproject.com/route/107235482/g3,1,Colorado > Estes Park Valley > CO Hwy 7 & Tributaries > The Crags > Lower Great Face > C. Wizard's Gate,2.9,-1,Lead,Onsight,Sport,,95.0,4600.0
2024-06-09,Soler,5.9,"Linked p1-p2 with 80m -mistake
Didnt bring any #3s and only one #2 
And only 4nuts -mistake

Couldnt clip with left hand through p2 due to bruised rib and rope drag

There are anchors at the top of pillar, but they are to the left a bit and we wanted to go to the top. So I climbed past them about 10m and made an anchor.

Weather was really nice.
",https://www.mountainproject.com/route/105714830/soler,4,Wyoming > Devils Tower > South and East Faces,3.6,-1,,,Trad,,280.0,2400.0
2024-06-08,Tulgey Wood,5.10a,"Due to north closer for falcons, got pushed onto this by convenience. Wasn’t bad, but the sun set as I was climbing P1. I was climbing slower than usual, so we decided not to finish the other pitches. P3 looked like a never ending flaring hand crack this I may come back to some day with double Ropes and #4s… also, I only had a single 80m so the night-descent-finding would have been terrible.

E climbed this crack very well.",https://www.mountainproject.com/route/105714953/tulgey-wood,1,Wyoming > Devils Tower > West Face,3.6,-1,Lead,,Trad,,300.0,2600.0
2024-04-14,American Beauty,5.12b,"I went left at the crux. So maybe not a scend of the proper route. I tried the direct route for about 5min before deciding to go left to preserve a partial onsight. Personally, i think going left was a lot easier and I’d rate it 11d. 
Direct route seemed harder than 12b. ",https://www.mountainproject.com/route/105757510/american-beauty,1,Colorado > Boulder > Boulder Canyon > The Sport Park > Surprising Crag > West Face,3.1,-1,Lead,Onsight,Sport,,70.0,6900.0
2024-04-14,Killer Fish Taco,5.11a,Bit tricky on the head wall. I climbed slightly left of the bolt line. Katherine belayed me. We were here with Tim and Nora and Quinn too.,https://www.mountainproject.com/route/105754729/killer-fish-taco,1,Colorado > Boulder > Boulder Canyon > The Sport Park > Surprising Crag > South Face,2.3,-1,Lead,Onsight,Sport,,,4600.0
2024-04-14,Hood Surfing In Socks,5.11c,"Again, I went off route. The direct line on this felt 12d. Maybe it was the harsh sun on the slab, but either using the arete or the dihedral eases the difficulty significantly to about a 10d.",https://www.mountainproject.com/route/105752230/hood-surfing-in-socks,1,Colorado > Boulder > Boulder Canyon > The Sport Park > Surprising Crag > South Face,1.8,-1,Lead,Onsight,Sport,,,5200.0
2024-04-14,Platinum Curl,5.11,This is basically just a V5 boulder problem In the middle of wall. Burly side pulling.,https://www.mountainproject.com/route/105752233/platinum-curl,1,Colorado > Boulder > Boulder Canyon > The Sport Park > Surprising Crag > South Face,1.9,-1,Lead,Fell/Hung,Sport,5.12a,,5000.0
2024-04-14,Dirty Dave's Dumpster Dive,5.10a,"Great varied climbing. Hand jams, roof, dihedral and face climbing.",https://www.mountainproject.com/route/105764181/dirty-daves-dumpster-dive,1,Colorado > Boulder > Boulder Canyon > The Sport Park > Surprising Crag > South Face,1.8,-1,Lead,,Sport,,50.0,2600.0
2024-04-13,Eastern Promises,5.13c,"Dude, I need help on this route. 
Ran out of time day. Barely tried the crux even once today. Sun was going down and wasn’t feeling it.",https://www.mountainproject.com/route/106304393/eastern-promises,1,Colorado > Boulder > Boulder Canyon > Lower Dream Canyon > Berlin Wall,2.7,-1,TR,,Sport,,75.0,9200.0
2024-04-13,Interrogation,5.12c/d,"New high point to the 2 bolt after the overhang, but just jugged the rest since I wasn’t feeling it. I felt like it was too hot today and the friction felt even worse on the slab. ",https://www.mountainproject.com/route/105760023/interrogation,1,Colorado > Boulder > Boulder Canyon > Lower Dream Canyon > Berlin Wall,3.6,-1,Lead,Fell/Hung,Sport,5.13a/b,80.0,7400.0
2024-04-07,Interrogation,5.12c/d,"The slab after the roof has 3 distinct cruxes
1 right foot pistol squat
2 side pull twin cracks
3 exiting the cracks out right",https://www.mountainproject.com/route/105760023/interrogation,1,Colorado > Boulder > Boulder Canyon > Lower Dream Canyon > Berlin Wall,3.6,-1,Lead,Fell/Hung,Sport,5.13a/b,80.0,7400.0
2024-04-07,Eastern Promises,5.13c,The section above the roof with the crimp side pulls still feels impossible. Heel toe cam beta gets me past the roof section fine tho.,https://www.mountainproject.com/route/106304393/eastern-promises,1,Colorado > Boulder > Boulder Canyon > Lower Dream Canyon > Berlin Wall,2.7,-1,TR,,Sport,,75.0,9200.0
2024-03-30,Interrogation,5.12c/d,The crux of transition into the right finger crack and then getting to the top is a sustained crux where you must trust granite’s friction and fragile fingernail crimps. ,https://www.mountainproject.com/route/105760023/interrogation,1,Colorado > Boulder > Boulder Canyon > Lower Dream Canyon > Berlin Wall,3.6,-1,Lead,Fell/Hung,Sport,5.13a/b,80.0,7400.0
2024-03-30,Eastern Promises,5.13c,"I think this route my new impossible. The roof is manageable, but pulling on the sidepull crimps to get onto the head wall is not something I’ve been able to do in isolation.",https://www.mountainproject.com/route/106304393/eastern-promises,1,Colorado > Boulder > Boulder Canyon > Lower Dream Canyon > Berlin Wall,2.7,-1,TR,,Sport,,75.0,9200.0
2024-03-24,"To Boo, or Not to Boo",5.10a,,https://www.mountainproject.com/route/112556981/to-boo-or-not-to-boo,1,Utah > Southeast Utah > River Road > Take-Out Beach > The Theater,2.9,-1,,,Sport,,75.0,2600.0
2024-03-24,Encore,5.11a,,https://www.mountainproject.com/route/112554704/encore,1,Utah > Southeast Utah > River Road > Take-Out Beach > The Cinema,3.3,-1,Lead,Onsight,Sport,,80.0,4600.0
2024-03-24,Lucy in the Sky with Potash,5.10b,Used the arete at the crux. ,https://www.mountainproject.com/route/105717580/lucy-in-the-sky-with-potash,1,Utah > Southeast Utah > Potash Road > Wall Street,2.9,4,Lead,Flash,Trad,5.11a,,2900.0
2024-03-23,Nervous in Suburbia,5.10a,"Felt 10dog. E was feeling pretty confident and wanted to put up the draws. I was a bit miffed at the climb for punishing her confidence by being a fairly mental lead.
Fun ppl to the left and right as always. Learned 2 new words today. Parsimonious and another that starts with “c” but means nearly the same as parsimonious but more simple.",https://www.mountainproject.com/route/105717502/nervous-in-suburbia,1,Utah > Southeast Utah > Potash Road > Wall Street,3.1,4,Lead,Onsight,Sport,5.10d,50.0,2600.0
2024-03-21,Rosy Crucifixion,5.10b PG13,"Those who think this is the best route have never tasted sugar or experienced love. This route is poor quality in every way. The approach is standard sketch for eldo. The crux move was thoughtful, but it isn’t worth the effort for the 20ft of traversing on P1.
With Maddy",https://www.mountainproject.com/route/105748777/rosy-crucifixion,3,Colorado > Boulder > Eldorado Canyon State Park > Redgarden Wall > Redgarden - Tower Two,3.8,-1,Lead,Onsight,Trad,,170.0,2900.0
2024-03-21,E.L.100,5.8-,"Love the tree climb and the 5.7d rating.
The lil traverse to the vertigo anchors on the right prolly could have been avoided by climbing a little higher and walking up the ramp.",https://www.mountainproject.com/route/105753046/el100,1,Colorado > Boulder > Eldorado Canyon State Park > Redgarden Wall > Redgarden - Tower One,3.0,-1,Follow,,Trad,,130.0,2000.0
2024-02-16,Spitoon AKA: The Scoop,V3,"Nice warm up actually all things considered.  fairly intense heel hook tho. w Yibin, Jack, and Pancho. ",https://www.mountainproject.com/route/106221455/spitoon-aka-the-scoop,1,New Mexico > Jemez Mountains and Jemez Valley > Ponderosa Bouldering > The Pond > The Scoop Boulder,3.1,-1,Send,,Boulder,,15.0,20300.0
2024-01-28,"Dot Dot Space, AKA: V5 Arête",V5-,"Finished on this one.  Requires a hand match on a sloping crimp fairly high up. to me, was not worth risk. But my fav climb of the day.",https://www.mountainproject.com/route/106221527/dot-dot-space-aka-v5-arete,1,New Mexico > Jemez Mountains and Jemez Valley > Ponderosa Bouldering > The Pond > King for a Day Boulder,3.0,-1,Attempt,,Boulder,,25.0,20470.0
2024-01-28,The Joker,V6,Committing heel hook to meet up with King.  ,https://www.mountainproject.com/route/108025706/the-joker,1,New Mexico > Jemez Mountains and Jemez Valley > Ponderosa Bouldering > The Pond > King for a Day Boulder,3.7,-1,Attempt,,Boulder,,,20600.0
2024-01-28,Ticket Hag,V2,,https://www.mountainproject.com/route/106221521/ticket-hag,1,New Mexico > Jemez Mountains and Jemez Valley > Ponderosa Bouldering > The Pond > King for a Day Boulder,2.7,-1,Flash,,Boulder,,14.0,20200.0
2024-01-28,King for a Day,V7,Tried many times. vsmall slopey holds to a big move in a dihedral with dubious foot holds.  and let&#39;s not forget about that dyno finish above the ankle breaker rock,https://www.mountainproject.com/route/106221514/king-for-a-day,1,New Mexico > Jemez Mountains and Jemez Valley > Ponderosa Bouldering > The Pond > King for a Day Boulder,3.8,-1,Attempt,,Boulder,,,20700.0
2024-01-28,Double Noggin Buster,V2,,https://www.mountainproject.com/route/106646922/double-noggin-buster,1,New Mexico > Jemez Mountains and Jemez Valley > Ponderosa Bouldering > The Pond > TMBJ Boulder,1.8,-1,,,Boulder,,10.0,20200.0
2024-01-28,TMBJ,V10,Yibin and the local were making good progress while the doggos muddied up the pads. ,https://www.mountainproject.com/route/106361924/tmbj,1,New Mexico > Jemez Mountains and Jemez Valley > Ponderosa Bouldering > The Pond > TMBJ Boulder,2.8,-1,Attempt,,Boulder,,20.0,21000.0
2024-01-28,Well at Least it Looked Cool,V3-,"Fun crack. Not sure if this actually is the crack route... 
bit of a high-ball",https://www.mountainproject.com/route/106353594/well-at-least-it-looked-cool,1,New Mexico > Jemez Mountains and Jemez Valley > Ponderosa Bouldering > The Pond > The Scoop Boulder,1.5,-1,Send,,Boulder,,20.0,20270.0
2024-01-28,Spat On,V1-2,,https://www.mountainproject.com/route/116704675/spat-on,1,New Mexico > Jemez Mountains and Jemez Valley > Ponderosa Bouldering > The Pond > The Scoop Boulder,2.0,-1,Send,,Boulder,,15.0,20150.0
2024-01-28,Spittoon,V4,,https://www.mountainproject.com/route/119650316/spittoon,1,Utah > Central Utah > Joe's Valley > Right Fork > Big Spud,2.5,-1,,,Boulder,,12.0,20400.0
2023-12-20,Sleepless in Boulder,5.11b,This route is a classic,https://www.mountainproject.com/route/105756106/sleepless-in-boulder,1,Colorado > Boulder > Boulder Canyon > Lower Dream Canyon > Plotinus Wall > Left Side,2.9,4,Lead,,Sport,,,4900.0
2023-12-20,The Scientist,5.11a/b,The holds are crazy. It’s a wild ride!,https://www.mountainproject.com/route/105759351/the-scientist,1,Colorado > Boulder > Boulder Canyon > Lower Dream Canyon > Plotinus Wall > Middle,3.4,3,Lead,,Trad,,80.0,4800.0
2023-12-20,Boulder Quartz System,5.12a,"Thx for hangin the draws Trevor! 
Got bomber knee bar at crux. After crux, I pulled too far the right and had to traverse on crimps.",https://www.mountainproject.com/route/105755836/boulder-quartz-system,1,Colorado > Boulder > Boulder Canyon > Lower Dream Canyon > Plotinus Wall > Right Side,3.2,2,Lead,Flash,Sport,,75.0,6600.0
2023-12-17,Eastern Promises,5.13c,"Just tried the crux moves from bolt 3 - 6.
Feels like the hardest part of the route is landing a tough rh bump from blady sidepull to dodgy pinch and then pulling hard on the dodgy pinch. 
We’ll see how it feels on lead next week.",https://www.mountainproject.com/route/106304393/eastern-promises,1,Colorado > Boulder > Boulder Canyon > Lower Dream Canyon > Berlin Wall,2.7,-1,TR,,Sport,,75.0,9200.0
2023-12-16,Tough Situation,5.10a,The roof crux is so fun! And then the dihedral doesn’t let up for another 10ft!,https://www.mountainproject.com/route/105748163/tough-situation,1,Colorado > Boulder > Boulder Canyon > Elephant Buttresses > Second Buttress,2.6,3,Lead,,Trad,,60.0,2600.0
2023-12-16,Classic Finger Crack,5.9,"Lead through Trevor’s gear
Anchor at the top was full of options.
We hiked up here the wrong way... I hate it when the approach is the most dangerous part of the day.",https://www.mountainproject.com/route/105748169/classic-finger-crack,1,Colorado > Boulder > Boulder Canyon > Elephant Buttresses > Second Buttress,2.7,1,Lead,,Trad,,,2400.0
2023-12-15,Interrogation,5.12c/d,"IMO, this is a 13a slab route. The slab above the roof doesn’t seem to have any beta that doesn’t require fingernailing fragile micro holds ",https://www.mountainproject.com/route/105760023/interrogation,1,Colorado > Boulder > Boulder Canyon > Lower Dream Canyon > Berlin Wall,3.6,-1,Lead,Fell/Hung,Sport,5.13a/b,80.0,7400.0
2023-12-06,Round the Corner,WI4-5,"w Rob. Conditions were great, snow and hike was type 1.5 fun. Loved it. Turns out, ice climbing isn’t so bad if you use a tool instead of an axe XP",https://www.mountainproject.com/route/105747333/round-the-corner,2,Colorado > CO Ice & Mixed > Tenmile Canyon aka Officer's Gulch,3.1,-1,,,"Trad, Ice",,300.0,33500.0
2023-11-30,The Headache,5.10,"W Sofia. Climbed with 80m np. Maybe having an 80m isn’t such a stupid idea…But on the first rap, make sure you go to the anchors on the right and not the ones directly below, lol. 
There was a guy a shrooms blasting alien music into the canyon. Playful vibes",https://www.mountainproject.com/route/105718186/the-headache,3,Utah > Southwest Utah > Zion National Park > Mount Carmel Tunnel > Headache Area,3.9,4,Lead,,Trad,,380.0,3000.0
2023-11-27,Tunnel Vision,5.7,"EB was striped tiger and Eby was smooth dolphin. I, the cave yeti, growled in the cave. We made some friends that tried to catch us and we giggled about emissivity and grey bodies at the van afterward.
Who needs doubles when you have an 80m XP",https://www.mountainproject.com/route/105732509/tunnel-vision,6,Nevada > Southern Nevada > Red Rocks > (06) White Rock Spring > Angel Food Area > Angel Food Wall,3.1,4,Lead,,Trad,,770.0,1800.0
2023-11-26,Windshield Wiper,V0,,https://www.mountainproject.com/route/125418700/windshield-wiper,1,Nevada > Southern Nevada > Red Rock Boulders > (03) Second Pullout Boulders > Bus Wedge Boulder,1.0,-1,,,Boulder,,,20008.0
2023-11-26,Teacher's Earrings,V2,Frizzle always be rockin Earrings that put Brayden to shame. ,https://www.mountainproject.com/route/125418671/teachers-earrings,1,Nevada > Southern Nevada > Red Rock Boulders > (03) Second Pullout Boulders > Bus Wedge Boulder,2.0,-1,,,Boulder,,,20200.0
2023-11-26,Inside Ralphie,V2-3,This is ridiculous. and lovely. I climbed some rocks and Oak took pictures. Now I&#39;m famous. Prolly my first FA. Oak did not approve of this allusion to Magic School Bus episode title. ,https://www.mountainproject.com/route/125418652/inside-ralphie,1,Nevada > Southern Nevada > Red Rock Boulders > (03) Second Pullout Boulders > Bus Wedge Boulder,2.0,-1,,,Boulder,,,20250.0
2023-11-26,SOS,5.13-,"Honestly, felt hard for 13a to me. I stared to pull real hard on the undercling, but given that it was day 10 in a row, I decided not to risk the tendons and skip the cruxes. Elizabeth got on it as her first 13 attempt and Shawn almost sent on his last attempt. We drank beer in the sun in between attempts.",https://www.mountainproject.com/route/105808879/sos,1,Nevada > Southern Nevada > Red Rocks > (03) First Pullout (Calico I) > Tsunami Wall,3.1,2,Lead,Fell/Hung,Sport,,35.0,8700.0
2023-11-26,Electric Koolaid,5.9+,Nice sunny warm up while oak annie and I played around on the scattered boulders.,https://www.mountainproject.com/route/105732323/electric-koolaid,1,Nevada > Southern Nevada > Red Rocks > (04) Second Pullout (Calico II) > Magic Bus,2.2,2,Lead,,"Sport, TR",,50.0,2500.0
2023-11-25,Bigwank,5.9,Placed Norm’s #7!!! Which was not at all useful or necessary lol,https://www.mountainproject.com/route/107914182/bigwank,1,Nevada > Southern Nevada > Red Rocks > (01) Calico Basin > Kraft Mountain Area > Yin and Yang Cliff,2.3,3,Lead,,Trad,,20.0,2400.0
2023-11-25,Miniwanka,5.7,Elizabeth got stoked for this after watching Susan lead it. Was chill crack. ,https://www.mountainproject.com/route/107077673/miniwanka,1,Nevada > Southern Nevada > Red Rocks > (01) Calico Basin > Kraft Mountain Area > Yin and Yang Cliff,1.9,-1,Lead,,Trad,,40.0,1800.0
2023-11-25,Atman,5.10a,Pretty relaxing and short hand crack. Most everyone was out of steam at this point and they left to get fish and chips while E and I stayed for a few more climbs.,https://www.mountainproject.com/route/105732482/atman,1,Nevada > Southern Nevada > Red Rocks > (01) Calico Basin > Kraft Mountain Area > Yin and Yang Cliff,3.1,3,Lead,,Trad,,40.0,2600.0
2023-11-25,Yin and Yang,5.11a,"I was inspired by Annie to climb more 12s after watching her send this. For me, the crack was just varied and flared enough that I had to think about it, but I wasn’t able to extract the same adventure from it that annie was able to.",https://www.mountainproject.com/route/105732485/yin-and-yang,1,Nevada > Southern Nevada > Red Rocks > (01) Calico Basin > Kraft Mountain Area > Yin and Yang Cliff,3.6,3,Lead,Onsight,Trad,,40.0,4600.0
2023-11-25,Peak Performance,5.11d,"Basically an 5.11d boulder problem (which stumped me for like 4 attempts, before Kelsey [def not Mimi] insisted that I the out of sight pocket), followed up by 40ft of 5.9",https://www.mountainproject.com/route/106516274/peak-performance,1,Nevada > Southern Nevada > Red Rocks > (01) Calico Basin > Kraft Mountain Area > Sunny and Steep,2.7,1,Lead,,Sport,,45.0,5500.0
2023-11-24,Prince of Darkness,5.10c,"W Elizabeth and sir oak! Vfun day. Oak always brings vibes strong enough to keep us warm. Helicopter picked up some dude who broke foot on epi, while we shivered our way up. Some guy next to us on Turkey was wearing mittens and down pants.",https://www.mountainproject.com/route/105732458/prince-of-darkness,6,Nevada > Southern Nevada > Red Rocks > (16) Black Velvet Canyon > Black Velvet Wall,3.1,2,Lead,,"Trad, Sport",,700.0,3200.0
2023-11-23,Scorpions,5.11a,Some cool guys let’s us climb through their draws. Juggy easy 11a. Elizabeth’s tendons we’re giving her lip. ,https://www.mountainproject.com/route/105949670/scorpions,1,Nevada > Southern Nevada > Red Rocks > (01) Calico Basin > Kraft Mountain Area > Sunny and Steep,3.0,2,Lead,,Sport,,40.0,4600.0
2023-11-23,Sport Chimney,5.8,"Lol, did Twice. Love it. Having a bolted chimney next to all these great routes is hilarious. And the kind of hilarity im into.",https://www.mountainproject.com/route/106516267/sport-chimney,2,Nevada > Southern Nevada > Red Rocks > (01) Calico Basin > Kraft Mountain Area > Sunny and Steep,2.7,3,Lead,,Sport,,70.0,2100.0
2023-11-23,Working for Peanuts,5.9+,ElizBeths first lead of the trip! A bit headed on the first couple bolts. Made some friends that were installed Xmas lights in vegas and i gave them a catch on choads.,https://www.mountainproject.com/route/106601293/working-for-peanuts,1,Nevada > Southern Nevada > Red Rocks > (01) Calico Basin > Kraft Mountain Area > Sunny and Steep,1.7,-1,,,Sport,,60.0,2500.0
2023-11-23,Mr Choad's Wild Ride,5.11b,"Worth the stars. Pumpy, varied, sustained, and a lil runout. Definitely a great 11b test piece.",https://www.mountainproject.com/route/106375205/mr-choads-wild-ride,1,Nevada > Southern Nevada > Red Rocks > (01) Calico Basin > Kraft Mountain Area > Sunny and Steep,3.7,4,Lead,Onsight,Sport,,105.0,4900.0
2023-11-22,Tunnel Vision,5.7,W Tom and jack and kels. Jack stoke my 0.3s. So fun I did it again 4 days later. Sneaky perfect 0.75 placement in cave:,https://www.mountainproject.com/route/105732509/tunnel-vision,6,Nevada > Southern Nevada > Red Rocks > (06) White Rock Spring > Angel Food Area > Angel Food Wall,3.1,4,,,Trad,,770.0,1800.0
2023-11-21,Rock Warrior,5.10b R,"Was constantly full of intriguing 5.10 crux on after the other, whilst being uncomfortably above your last protection.
If you don’t like balzy climbs. Climb Dark Prince. It is so tantalizing to have all their bolts just 20ft to your right while your 30ft above your last nut.  Didnt love it. Aptly named, cuz it feels like your at war since your ankles are on the line.  w Jack and Tom",https://www.mountainproject.com/route/105883684/rock-warrior,2,Nevada > Southern Nevada > Red Rocks > (16) Black Velvet Canyon > Black Velvet Wall,3.6,0,Lead,,Trad,,,2900.0
2023-11-20,Arms Reduction,5.9,Linked the pitches to get into Armatron,https://www.mountainproject.com/route/105955835/arms-reduction,2,Nevada > Southern Nevada > Red Rocks > (11) Juniper Canyon > Brownstone Wall,2.3,1,Lead,,Trad,,400.0,2400.0
2023-11-20,Armatron,5.9-,"Was a crowd, so skipped the first couple pitches via the climb to right (which was forgettable).
Caught up to Harrison the biologist and his sidekick Ryan for good company.
W jack and Tom.",https://www.mountainproject.com/route/105809181/armatron,4,Nevada > Southern Nevada > Red Rocks > (11) Juniper Canyon > Brownstone Wall,3.6,3,Lead,,Trad,,680.0,2300.0
2023-11-19,Frogland,5.8,"W jack. His shoulder need to be felt out after breaking it 2 mo ago. Got up late, passed a huge crowd and climbed super fast. Back to car by 1pm.",https://www.mountainproject.com/route/105732398/frogland,6,Nevada > Southern Nevada > Red Rocks > (16) Black Velvet Canyon > Whiskey Peak > North Face,3.6,4,Lead,,Trad,,700.0,2100.0
2024-11-30,Solar Slab,5.6,"EB led p1 and p3, i lead the rest. LP and E were ahead, traffic jam pn the rappels. Couldnt believe our ropes didnt get stuck. I enjoyed the diagonal chimney on p2 and running through p4 and p5.",https://www.mountainproject.com/route/105732257/solar-slab,9,Nevada > Southern Nevada > Red Rocks > (12) Oak Creek Canyon > Solar Slab - Upper Tier,3.5,3,,,Trad,5.6,1220.0,1600.0
2024-11-29,Dark Shadows,5.8,"Lead p234 with sr and eb. P3 was superb stemming, crack, and face climbing. Follower fell on some slack and soft decked at the belay",https://www.mountainproject.com/route/105732380/dark-shadows,4,Nevada > Southern Nevada > Red Rocks > (10) Pine Creek Canyon > Mescalito > Dark Shadows Wall,3.6,4,,,Trad,5.8,350.0,2100.0
2024-11-28,Olive Oil,5.7,"Lead with SR, eb and tu behind. Very fun route, last pitch was great stemming in the dihedral",https://www.mountainproject.com/route/105732494/olive-oil,5,Nevada > Southern Nevada > Red Rocks > (11) Juniper Canyon > Rose Tower,3.4,4,,,Trad,5.7,600.0,1800.0
